{"schema_version":"1.0.0-fixture","fixture":true,"operational":false,"status":"IN_PROGRESS","summary":"R1 is complete and archived; R2A design is active with implementation and acquisition still unauthorized.","current_phase":"R2A design contracts","architecture_completion_percent":60,"implementation_completion_percent":0,"open_blocker_count":1,"required_groups":[{"group_id":"B02001","status":["REQUIRED_BY_CONTRACT","NOT_ACQUIRED_IN_REIMPLEMENTATION","ACQUISITION_UNAUTHORIZED"]},{"group_id":"B03001","status":["REQUIRED_BY_CONTRACT","NOT_ACQUIRED_IN_REIMPLEMENTATION","ACQUISITION_UNAUTHORIZED"]},{"group_id":"B04006","status":["REQUIRED_BY_CONTRACT","NOT_ACQUIRED_IN_REIMPLEMENTATION","ACQUISITION_UNAUTHORIZED"]},{"group_id":"B05003","status":["REQUIRED_BY_CONTRACT","NOT_ACQUIRED_IN_REIMPLEMENTATION","ACQUISITION_UNAUTHORIZED"]},{"group_id":"B05006","status":["REQUIRED_BY_CONTRACT","NOT_ACQUIRED_IN_REIMPLEMENTATION","ACQUISITION_UNAUTHORIZED"]}],"tasks":[{"title":"R1 foundation and recovery archive","status":"COMPLETE","detail":"Verified archive SHA-256 0bdf87319b39fe3e231047e37ba67841282c666918e8f058b278478406a1bd97."},{"title":"R2A Task 1 contract","status":"COMPLETE","detail":"Acquisition and refresh contract accepted."},{"title":"R2A Task 2A schemas","status":"COMPLETE","detail":"Canonical data-model schemas accepted."},{"title":"R2A Task 2B state machine","status":"COMPLETE","detail":"Refresh state machine accepted."},{"title":"R2A Task 2C failure registry","status":"NOT_STARTED","detail":"Next Cultural design task."},{"title":"Variable mapping gap","status":"BLOCKED","detail":"GAP_ACS_GROUP_VARIABLE_MAPPING_INCOMPLETE remains open."}]}